{
  "id": "com.sky.myapp",
  "specVersion": "1.1.0",
  "version": "1.2.3",
  "versionName": "1.2.3-beta",
  "name": "My Application",
  "packageType": "application",
  "packageSpecifier": "html",
  "entryPoint": "web/index.html",
  "entryArgs": ["--some-option=true"],
  "dependencies": {
    "rdk.browser.wpe": ">=1.1.0"
  },
  "permissions": [
    "urn:rdk:permission:home-app",
    "urn:rdk:permission:internet",
    "urn:rdk:permission:firebolt",
    "urn:rdk:permission:thunder",
    "urn:rdk:permission:rialto",
    "urn:rdk:permission:game-controller",
    "urn:rdk:permission:timeshift-buffer",
    "urn:rdk:permission:external-storage::read",
    "urn:rdk:permission:external-storage::write",
    "urn:rdk:permission:display-overlay",
    "urn:rdk:permission:compositor"
  ],
  "configuration": {
    "urn:rdk:config:overrides": {
      "application": {
        "colorTheme": "vivid"
      },
      "runtime": {
        "userAgent": "BBC_requirement_requesting_Operator_Specific_UserAgent",
        "libInject": "oiptv.js",
        "mTls": "/etc/certs/client_operator.cert"
      }
    },
    "urn:rdk:config:log-levels": ["error", "warning", "info"],
    "urn:rdk:config:dial": {
      "appNames": ["MyMediaApp", "MediaRemote"],
      "corsDomains": ["http://example.com", "https://my-media.com"],
      "originHeaderRequired": true
    },
    "urn:rdk:config:application-lifecycle": {
      "supportedNonActiveStates": ["paused", "suspended", "hibernated"],
      "maxSuspendedSystemMemory": "16M",
      "maxTimeToSuspendMemoryState": 10,
      "startupTimeout": 60,
      "watchdogInterval": 30
    },
    "urn:rdk:config:platform": {
      "architecture": "arm",
      "variant": "v7",
      "os": "linux"
    },
    "urn:rdk:config:input-handling": {
      "keyCapture": ["play", "pause", "stop", "fastForward", "rewind"],
      "keyMonitor": ["volumeUp", "volumeDown", "mute"]
    },
    "urn:rdk:config:window": {
      "virtualDisplaySize": 1080
    },
    "urn:rdk:config:memory": {
      "system": "256M",
      "gpu": "128M"
    },
    "urn:rdk:config:storage": {
      "maxLocalStorage": "32M",
      "sharedStorageAppId": "com.sky.myapp2"
    },
    "urn:rdk:config:env": {
      "COBALT_CERT_KEY_NAME": "example_key",
      "COBALT_MODEL_YEAR": "2025",
      "COBALT_INTEGRATOR_NAME": "ExampleOperator"
    },
    "urn:rdk:config:network": [
      {
        "name": "netflix-mdx",
        "port": 8009,
        "protocol": "tcp",
        "type": "public"
      },
      {
        "name": "com.example.myapp.service",
        "port": 1234,
        "protocol": "tcp",
        "type": "exported"
      },
      {
        "name": "com.example.someotherapp.service",
        "port": 4567,
        "protocol": "tcp",
        "type": "imported"
      }
    ]
  }
}
